{
  "$schema": "../../schema/product.schema.json",
  "schemaVersion": "1.0.0",
  "id": "extrudr-greentec-pro-cf",
  "materialId": "greentec",
  "brand": "Extrudr",
  "manufacturer": "FD3D GmbH (Extrudr)",
  "productName": "Extrudr GreenTEC Pro CF",
  "origin": "Österreich",
  "specimenType": "undeclared",
  "specimenNote": {
    "de": "Extrudr deklariert nicht, ob an gedruckten oder spritzgegossenen Prüfkörpern gemessen wurde. Nominelle Bruchdehnungen über 10 % deuten auf Rohstoffwerte hin. Temperaturwerte laut Fußnote erst ab 4 mm Wanddicke geprüft.",
    "en": "Extrudr does not declare whether values were measured on printed or moulded specimens. Nominal elongations above 10 % suggest raw-material values. Temperature values verified only from 4 mm wall thickness per the footnote."
  },
  "features": {
    "de": "7120 MPa Zug-E-Modul ist der höchste Steifigkeitswert dieser Datenbank — aus einem Biopolymer, ohne beheizte Kammer. Der Preis ist Sprödigkeit: 2,5 % Bruchdehnung und 4,6 kJ/m² gekerbt.",
    "en": "7120 MPa tensile modulus is the highest stiffness value in this database — from a biopolymer, without a heated chamber. The price is brittleness: 2.5 % elongation and 4.6 kJ/m² notched."
  },
  "datasheet": {
    "title": "Extrudr GreenTEC Pro CF — Technisches Datenblatt (DE)",
    "url": "https://s3.extrudr.com/extrudr-media/datasheets/tds/tds-de/greentec-pro-cf-TDS-de.pdf",
    "retrievedAt": "2026-08-01"
  },
  "productUrl": "https://extrudr.com/de/de/page/downloads-for-resellers/",
  "properties": {
    "tensileStrengthXy": {
      "value": 65,
      "unit": "MPa",
      "testStandard": "ISO 527",
      "source": "src_tds",
      "confidence": "medium"
    },
    "tensileModulusXy": {
      "value": 7120,
      "unit": "MPa",
      "testStandard": "ISO 527",
      "source": "src_tds",
      "confidence": "medium"
    },
    "elongationAtBreakXy": {
      "value": 2.5,
      "unit": "%",
      "testStandard": "ISO 527-2 (nominell)",
      "source": "src_tds",
      "confidence": "medium"
    },
    "charpyNotchedXy": {
      "value": 4.6,
      "unit": "kJ/m²",
      "testStandard": "ISO 179/1eA",
      "source": "src_tds",
      "confidence": "medium"
    },
    "charpyUnnotchedXy": {
      "value": 82,
      "unit": "kJ/m²",
      "testStandard": "ISO 179/1eU",
      "source": "src_tds",
      "confidence": "medium"
    },
    "vicatA": {
      "value": 165,
      "unit": "°C",
      "testStandard": "ISO 306",
      "conditions": "Temperaturbeständigkeit laut Datenblatt-Fußnote nur bei Wanddicke ab 4 mm geprüft",
      "source": "src_tds",
      "confidence": "medium"
    },
    "hdtB": {
      "value": 115,
      "unit": "°C",
      "testStandard": "ISO 75",
      "conditions": "Temperaturbeständigkeit laut Datenblatt-Fußnote nur bei Wanddicke ab 4 mm geprüft",
      "source": "src_tds",
      "confidence": "medium"
    },
    "density": {
      "value": 1.2,
      "unit": "g/cm³",
      "testStandard": "ISO 1183",
      "source": "src_tds",
      "confidence": "medium"
    },
    "nozzleTemperature": {
      "value": 240,
      "unit": "°C",
      "min": 225,
      "max": 250,
      "source": "src_tds",
      "confidence": "medium"
    },
    "bedTemperature": {
      "value": 55,
      "unit": "°C",
      "min": 20,
      "max": 90,
      "source": "src_tds",
      "confidence": "medium"
    }
  },
  "governance": {
    "lastReviewed": "2026-08-01",
    "reviewedBy": "Claude Code (Erstimport aus Herstellerdatenblatt)",
    "sources": [
      {
        "id": "src_tds",
        "type": "manufacturer-tds",
        "publisher": "FD3D GmbH (Extrudr)",
        "productName": "Extrudr GreenTEC Pro CF",
        "title": "Extrudr GreenTEC Pro CF — Technisches Datenblatt (DE)",
        "url": "https://s3.extrudr.com/extrudr-media/datasheets/tds/tds-de/greentec-pro-cf-TDS-de.pdf",
        "retrievedAt": "2026-08-01",
        "confidenceCeiling": "high",
        "note": {
          "de": "Herstellerdatenblatt. Die Brandschutz-Einstufungen (UL94, EN 45545) sind entweder erteilt oder nicht und gelten deshalb als gesichert. Bei den mechanischen Werten gibt Extrudr nicht an, ob an gedruckten oder spritzgegossenen Prüfkörpern gemessen wurde; sie gelten deshalb nur als einfach belegt. Temperaturwerte gelten laut Fußnote erst ab 4 mm Wanddicke.",
          "en": "Manufacturer datasheet. The fire ratings (UL94, EN 45545) are either granted or not and therefore count as reliable. For the mechanical values Extrudr does not state whether they were measured on printed or moulded specimens, so they count as singly substantiated only. Temperature values apply only from 4 mm wall thickness according to the footnote."
        }
      }
    ]
  }
}
