{
  "$schema": "../../schema/product.schema.json",
  "schemaVersion": "1.0.0",
  "id": "addnorth-petg-v0",
  "materialId": "petg",
  "brand": "add:north",
  "manufacturer": "add:north 3D filaments AB",
  "productName": "add:north PETG Flame Retardant V0",
  "origin": "Schweden",
  "specimenType": "undeclared",
  "specimenNote": {
    "de": "Dieses Blatt sagt nicht, ob an gedruckten oder spritzgegossenen Prüfkörpern gemessen wurde. Es nennt auch keine Druckparameter, keine Prüfgeschwindigkeit und keine Prüftemperatur — nur Norm, Einheit und Zahl.\n\nHinweis zu allen Blättern dieses Herstellers: Alle fünfzehn add:north-Blätter führen die Dichte unter ISO 527, der Norm für den Zugversuch — für die Dichte wäre ISO 1183 einschlägig. Ein Fehler, der fünfzehnmal identisch auftritt, stammt aus der Vorlage und nicht aus dem Labor. Er sagt nichts über die Zahlenwerte selbst, aber etwas darüber, wie sorgfältig die Normangaben gepflegt werden. Die Dichteangaben gelten deshalb als schwach belegt.",
    "en": "This sheet does not say whether values were measured on printed or moulded specimens. It also names no print parameters, no test speed and no test temperature — only standard, unit and figure.\n\nNote on all sheets from this manufacturer: All fifteen add:north sheets carry density under ISO 527, the standard for tensile TESTING — for density ISO 1183 would apply. An error appearing identically fifteen times comes from the template, not the laboratory. It says nothing about the figures themselves but something about how carefully the standards are maintained. The density values therefore count as weakly substantiated."
  },
  "features": {
    "de": "Das Blatt nennt die Klasse ausdrücklich und dazu, was nicht enthalten ist: keine halogenbasierten Flammschutzmittel, kein roter Phosphor. Beides ist für Bahn- und Innenraumanwendungen die eigentlich interessante Angabe. Der Preis steht daneben: Bruchdehnung 5 % statt 24 % beim normalen PETG desselben Herstellers — der Flammschutz kostet vier Fünftel der Zähigkeit.",
    "en": "The sheet names the class explicitly and, alongside it, what is not contained: no halogen-based flame retardants, no red phosphorus. For rail and interior applications both are the genuinely interesting statement. The price stands next to it: elongation at break 5 % instead of 24 % for the same manufacturer's ordinary PETG — flame retardancy costs four fifths of the toughness."
  },
  "datasheet": {
    "title": "add:north PETG Flame Retardant V0 — Technical Data Sheet",
    "url": "https://storage.googleapis.com/addnorth-com.appspot.com/imgix/assets/production/TDS_PETGv0_oY3Rem.pdf",
    "retrievedAt": "2026-08-02"
  },
  "productUrl": "https://addnorth.com/",
  "properties": {
    "density": {
      "value": 1.25,
      "unit": "g/cm³",
      "testStandard": "im Blatt als ISO 527 angegeben (siehe Hinweis); richtig wäre ISO 1183",
      "source": "src_tds",
      "confidence": "low",
      "note": {
        "de": "Die Norm im Blatt ist falsch: ISO 527 prüft Zugeigenschaften, nicht die Dichte. Der Zahlenwert selbst ist plausibel und übernommen.",
        "en": "The standard in the sheet is wrong: ISO 527 tests tensile properties, not density. The figure itself is plausible and has been imported."
      }
    },
    "tensileStrengthXy": {
      "value": 34,
      "unit": "MPa",
      "testStandard": "ISO 527",
      "conditions": "bei Bruch",
      "source": "src_tds",
      "confidence": "medium"
    },
    "tensileModulusXy": {
      "value": 2600,
      "unit": "MPa",
      "testStandard": "ISO 527",
      "source": "src_tds",
      "confidence": "medium"
    },
    "elongationAtBreakXy": {
      "value": 5,
      "unit": "%",
      "testStandard": "ISO 527",
      "source": "src_tds",
      "confidence": "medium"
    },
    "flexuralStrengthXy": {
      "value": 79,
      "unit": "MPa",
      "testStandard": "ISO 178",
      "source": "src_tds",
      "confidence": "medium"
    },
    "flexuralModulusXy": {
      "value": 2354,
      "unit": "MPa",
      "testStandard": "ISO 178",
      "source": "src_tds",
      "confidence": "medium"
    },
    "glassTransition": {
      "value": 70,
      "unit": "°C",
      "testStandard": "DSC",
      "source": "src_tds",
      "confidence": "medium"
    },
    "hdtB": {
      "value": 80,
      "unit": "°C",
      "testStandard": "ISO 75",
      "conditions": "0,45 MPa",
      "source": "src_tds",
      "confidence": "medium"
    }
  },
  "compliance": {
    "ul94": {
      "value": "V-0",
      "testStandard": "UL 94",
      "source": "src_tds",
      "confidence": "low",
      "note": {
        "de": "Das Blatt nennt die Klasse V-0 und dazu, dass weder halogenbasierte Flammschutzmittel noch roter Phosphor enthalten sind. Es nennt aber keine Materialdicke, keine Prüfstelle und keine Zeugnisnummer. Ohne Dickenangabe ist eine UL94-Klasse nicht übertragbar — dieselbe Rezeptur kann bei 1,5 mm V-0 und bei 0,8 mm nur V-2 erreichen.",
        "en": "The sheet names class V-0 and adds that neither halogen-based flame retardants nor red phosphorus are contained. It names no material thickness, no test house and no certificate number, however. Without a thickness a UL94 class is not transferable — the same formulation can reach V-0 at 1.5 mm and only V-2 at 0.8 mm."
      }
    }
  },
  "governance": {
    "lastReviewed": "2026-08-02",
    "reviewedBy": "Claude Code (Erstimport aus Herstellerdatenblatt)",
    "sources": [
      {
        "id": "src_tds",
        "type": "manufacturer-tds",
        "publisher": "add:north 3D filaments AB",
        "productName": "add:north PETG Flame Retardant V0",
        "title": "add:north PETG Flame Retardant V0 — Technical Data Sheet",
        "url": "https://storage.googleapis.com/addnorth-com.appspot.com/imgix/assets/production/TDS_PETGv0_oY3Rem.pdf",
        "retrievedAt": "2026-08-02",
        "confidenceCeiling": "low",
        "note": {
          "de": "Herstellerdatenblatt mit Textebene. Prüfkörper nicht deklariert, Dichtenorm auf allen Blättern falsch.",
          "en": "Manufacturer datasheet with text layer. Specimen not declared, density standard wrong on every sheet."
        }
      }
    ]
  }
}
