{
  "$schema": "../../schema/product.schema.json",
  "schemaVersion": "1.0.0",
  "id": "addnorth-adura-fda",
  "materialId": "pa12",
  "brand": "add:north",
  "manufacturer": "add:north 3D filaments AB",
  "productName": "add:north Adura FDA",
  "origin": "Schweden",
  "specimenType": "undeclared",
  "specimenNote": {
    "de": "Dieses Blatt sagt nicht, ob an gedruckten oder spritzgegossenen Prüfkörpern gemessen wurde. Es nennt auch keine Druckparameter, keine Prüfgeschwindigkeit und keine Prüftemperatur — nur Norm, Einheit und Zahl.\n\nHinweis zu allen Blättern dieses Herstellers: Alle fünfzehn add:north-Blätter führen die Dichte unter ISO 527, der Norm für den Zugversuch — für die Dichte wäre ISO 1183 einschlägig. Ein Fehler, der fünfzehnmal identisch auftritt, stammt aus der Vorlage und nicht aus dem Labor. Er sagt nichts über die Zahlenwerte selbst, aber etwas darüber, wie sorgfältig die Normangaben gepflegt werden. Die Dichteangaben gelten deshalb als schwach belegt.\n\nHinweis zu diesem Datenblatt: Sämtliche sieben Kennwerte sind Ziffer für Ziffer identisch mit denen des Adura-Blattes. Bei einer lebensmittelkonformen Variante desselben Grundpolymers ist das plausibel — es bedeutet aber, dass hier keine zweite Messung vorliegt, sondern dieselbe. Für die Datenbank zählt das als EIN Beleg, nicht als zwei.",
    "en": "This sheet does not say whether values were measured on printed or moulded specimens. It also names no print parameters, no test speed and no test temperature — only standard, unit and figure.\n\nNote on all sheets from this manufacturer: All fifteen add:north sheets carry density under ISO 527, the standard for tensile TESTING — for density ISO 1183 would apply. An error appearing identically fifteen times comes from the template, not the laboratory. It says nothing about the figures themselves but something about how carefully the standards are maintained. The density values therefore count as weakly substantiated.\n\nNote on this datasheet: All seven values are digit-for-digit identical with those of the Adura sheet. For a food-compliant variant of the same base polymer that is plausible — but it means there is no second measurement here, only the same one. For this database that counts as one piece of evidence, not two."
  },
  "datasheet": {
    "title": "add:north Adura FDA — Technical Data Sheet",
    "url": "https://storage.googleapis.com/addnorth-com.appspot.com/imgix/assets/production/adura_fda_tds_krynwK.pdf",
    "retrievedAt": "2026-08-02"
  },
  "productUrl": "https://addnorth.com/",
  "properties": {
    "density": {
      "value": 1.1,
      "unit": "g/cm³",
      "testStandard": "im Blatt als ISO 527 angegeben (siehe Hinweis); richtig wäre ISO 1183",
      "source": "src_tds",
      "confidence": "low",
      "note": {
        "de": "Die Norm im Blatt ist falsch: ISO 527 prüft Zugeigenschaften, nicht die Dichte. Der Zahlenwert selbst ist plausibel und übernommen.",
        "en": "The standard in the sheet is wrong: ISO 527 tests tensile properties, not density. The figure itself is plausible and has been imported."
      }
    },
    "tensileStrengthXy": {
      "value": 50,
      "unit": "MPa",
      "testStandard": "ISO 527",
      "conditions": "bei Bruch",
      "source": "src_tds",
      "confidence": "medium"
    },
    "tensileModulusXy": {
      "value": 1720,
      "unit": "MPa",
      "testStandard": "ISO 527",
      "source": "src_tds",
      "confidence": "medium"
    },
    "elongationAtBreakXy": {
      "value": 46,
      "unit": "%",
      "testStandard": "ISO 527",
      "source": "src_tds",
      "confidence": "medium"
    },
    "flexuralStrengthXy": {
      "value": 52,
      "unit": "MPa",
      "testStandard": "ISO 178",
      "source": "src_tds",
      "confidence": "medium"
    },
    "flexuralModulusXy": {
      "value": 1425,
      "unit": "MPa",
      "testStandard": "ISO 178",
      "source": "src_tds",
      "confidence": "medium"
    },
    "glassTransition": {
      "value": 51,
      "unit": "°C",
      "testStandard": "DSC",
      "source": "src_tds",
      "confidence": "medium"
    },
    "hdtB": {
      "value": 105,
      "unit": "°C",
      "testStandard": "ISO 75",
      "conditions": "0,45 MPa",
      "source": "src_tds",
      "confidence": "medium"
    }
  },
  "governance": {
    "lastReviewed": "2026-08-02",
    "reviewedBy": "Claude Code (Erstimport aus Herstellerdatenblatt)",
    "sources": [
      {
        "id": "src_tds",
        "type": "manufacturer-tds",
        "publisher": "add:north 3D filaments AB",
        "productName": "add:north Adura FDA",
        "title": "add:north Adura FDA — Technical Data Sheet",
        "url": "https://storage.googleapis.com/addnorth-com.appspot.com/imgix/assets/production/adura_fda_tds_krynwK.pdf",
        "retrievedAt": "2026-08-02",
        "confidenceCeiling": "low",
        "note": {
          "de": "Herstellerdatenblatt mit Textebene. Prüfkörper nicht deklariert, Dichtenorm auf allen Blättern falsch.",
          "en": "Manufacturer datasheet with text layer. Specimen not declared, density standard wrong on every sheet."
        }
      }
    ]
  }
}
