{
  "$schema": "../../schema/product.schema.json",
  "schemaVersion": "1.0.0",
  "id": "formfutura-premium-petg-fr",
  "materialId": "petg",
  "brand": "FormFutura",
  "manufacturer": "FormFutura BV",
  "productName": "Premium PETG Flame Retardant",
  "origin": "Niederlande",
  "specimenType": "undeclared",
  "specimenNote": {
    "de": "Dieses Blatt sagt nicht, ob an gedruckten oder spritzgegossenen Prüfkörpern gemessen wurde.\n\nHinweis zu diesem Datenblatt: Die Schlagzähigkeit ist als „Izod Notched“ bezeichnet, die Norm daneben lautet ISO 179-1eA — das ist der Charpy-Versuch mit Kerbe A. Geführt als Charpy nach der genannten Norm, mit LOW.",
    "en": "This sheet does not say whether values were measured on printed or moulded specimens.\n\nNote on this datasheet: The impact strength is labelled “Izod Notched” while the standard next to it reads ISO 179-1eA — that is the Charpy test with notch A. Held as Charpy per the named standard, with LOW."
  },
  "features": {
    "de": "Der Preis des Flammschutzes ist hier nachrechenbar: 3 kJ/m² gekerbte Schlagzähigkeit gegenüber 7,2 kJ/m² beim HDglass desselben Herstellers, und 40 MPa Streckspannung gegenüber 50 MPa. Flammschutzadditive stören die Molekülbeweglichkeit — das ist keine Rezepturschwäche, sondern der Mechanismus.",
    "en": "The price of flame retardancy is calculable here: 3 kJ/m² notched impact against 7.2 kJ/m² for the same manufacturer's HDglass, and 40 MPa yield stress against 50 MPa. Flame-retardant additives interfere with molecular mobility — that is not a formulation weakness but the mechanism."
  },
  "datasheet": {
    "title": "Premium PETG Flame Retardant — Technical Data Sheet",
    "url": "https://www.formfutura.com/web/content/263077?download=true",
    "version": "2025-01-15",
    "retrievedAt": "2026-08-04"
  },
  "productUrl": "https://www.formfutura.com/",
  "properties": {
    "density": {
      "value": 1.26,
      "unit": "g/cm³",
      "testStandard": "ISO 1183",
      "source": "src_tds",
      "confidence": "medium"
    },
    "tensileStrengthXy": {
      "value": 40,
      "unit": "MPa",
      "testStandard": "ISO 527",
      "conditions": "bei Streckgrenze, 5 mm/min",
      "orientation": "XY",
      "source": "src_tds",
      "confidence": "medium"
    },
    "tensileModulusXy": {
      "value": 2350,
      "unit": "MPa",
      "testStandard": "ISO 527",
      "conditions": "1 mm/min",
      "orientation": "XY",
      "source": "src_tds",
      "confidence": "medium"
    },
    "charpyNotchedXy": {
      "value": 3,
      "unit": "kJ/m²",
      "testStandard": "ISO 179-1eA",
      "conditions": "23 °C, gekerbt; im Blatt als „Izod“ bezeichnet",
      "orientation": "XY",
      "source": "src_tds",
      "confidence": "low"
    }
  },
  "compliance": {
    "ul94": {
      "value": "V-0",
      "testStandard": "UL 94",
      "source": "src_tds",
      "confidence": "low",
      "note": {
        "de": "Das Blatt nennt die Klasse V-0 und setzt selbst eine Fußnote darunter: „meets the self-extinguishing flammability standards of UL 94 V0, but is not certified by Underwriters Laboratories and does not have a UL number.“ Diese Offenheit ist anzuerkennen und ändert nichts an der Konsequenz — ohne Prüfzeugnis und ohne Dickenangabe ist die Angabe für eine Auditvorlage nicht verwendbar. Dieselbe Rezeptur kann bei 1,5 mm V-0 und bei 0,8 mm nur V-2 erreichen.",
        "en": "The sheet names class V-0 and puts a footnote under it itself: “meets the self-extinguishing flammability standards of UL 94 V0, but is not certified by Underwriters Laboratories and does not have a UL number.” That openness deserves credit and changes nothing about the consequence — without a test certificate and without a thickness the statement cannot be used for an audit submission. The same formulation can reach V-0 at 1.5 mm and only V-2 at 0.8 mm."
      }
    }
  },
  "governance": {
    "lastReviewed": "2026-08-04",
    "reviewedBy": "Claude Code (Erstimport aus Herstellerdatenblatt)",
    "sources": [
      {
        "id": "src_tds",
        "type": "manufacturer-tds",
        "publisher": "FormFutura BV",
        "productName": "Premium PETG Flame Retardant",
        "title": "Premium PETG Flame Retardant — Technical Data Sheet",
        "url": "https://www.formfutura.com/web/content/263077?download=true",
        "documentVersion": "2025-01-15",
        "retrievedAt": "2026-08-04",
        "confidenceCeiling": "medium",
        "note": {
          "de": "Herstellerdatenblatt mit Textebene. Prüfkörper nicht angegeben; einzelne Normangaben sind fehlerhaft, siehe die Hinweise an den betroffenen Werten.",
          "en": "Manufacturer datasheet with text layer. Specimen not stated; some standard references are incorrect, see the notes on the affected values."
        }
      }
    ]
  }
}
