{
  "$schema": "../../schema/product.schema.json",
  "schemaVersion": "1.0.0",
  "id": "extrudr-pctg",
  "materialId": "pctg",
  "brand": "Extrudr",
  "manufacturer": "FD3D GmbH (Extrudr)",
  "productName": "Extrudr PCTG",
  "origin": "Österreich",
  "specimenType": "undeclared",
  "specimenNote": {
    "de": "Extrudr deklariert nicht, ob an gedruckten oder spritzgegossenen Prüfkörpern gemessen wurde. Nominelle Bruchdehnungen über 10 % deuten auf Rohstoffwerte hin. Temperaturwerte laut Fußnote erst ab 4 mm Wanddicke geprüft.",
    "en": "Extrudr does not declare whether values were measured on printed or moulded specimens. Nominal elongations above 10 % suggest raw-material values. Temperature values verified only from 4 mm wall thickness per the footnote."
  },
  "features": {
    "de": "215 % Bruchdehnung und 94 kJ/m² Kerbschlagzähigkeit — PCTG ist deutlich zäher als PETG und trotzdem UL94 V-2 eingestuft. Der Preis dafür ist ein weicherer Werkstoff: 1650 MPa Biegemodul gegen 2100 MPa bei PETG.",
    "en": "215 % elongation at break and 94 kJ/m² notched impact — PCTG is markedly tougher than PETG and still classified UL94 V-2. The price is a softer material: 1650 MPa flexural modulus against 2100 MPa for PETG."
  },
  "datasheet": {
    "title": "Extrudr PCTG — Technisches Datenblatt (DE)",
    "url": "https://s3.extrudr.com/extrudr-media/datasheets/tds/tds-de/pctg-TDS-de.pdf",
    "retrievedAt": "2026-08-01"
  },
  "productUrl": "https://extrudr.com/de/de/page/downloads-for-resellers/",
  "properties": {
    "tensileStrengthXy": {
      "value": 43,
      "unit": "MPa",
      "testStandard": "ISO 527 (Streckspannung)",
      "source": "src_tds",
      "confidence": "medium"
    },
    "elongationAtBreakXy": {
      "value": 215,
      "unit": "%",
      "testStandard": "ISO 527",
      "source": "src_tds",
      "confidence": "medium"
    },
    "flexuralStrengthXy": {
      "value": 62,
      "unit": "MPa",
      "testStandard": "ISO 178",
      "source": "src_tds",
      "confidence": "medium"
    },
    "flexuralModulusXy": {
      "value": 1650,
      "unit": "MPa",
      "testStandard": "ISO 178",
      "source": "src_tds",
      "confidence": "medium"
    },
    "izodNotchedXy": {
      "value": 94,
      "unit": "kJ/m²",
      "testStandard": "ISO 180, 23 °C",
      "source": "src_tds",
      "confidence": "medium"
    },
    "hdtB": {
      "value": 76,
      "unit": "°C",
      "testStandard": "ISO 75",
      "conditions": "Temperaturbeständigkeit laut Datenblatt-Fußnote nur bei Wanddicke ab 4 mm geprüft",
      "source": "src_tds",
      "confidence": "medium"
    },
    "vicatA": {
      "value": 88,
      "unit": "°C",
      "testStandard": "ASTM D1525",
      "conditions": "Temperaturbeständigkeit laut Datenblatt-Fußnote nur bei Wanddicke ab 4 mm geprüft",
      "source": "src_tds",
      "confidence": "medium"
    },
    "density": {
      "value": 1.23,
      "unit": "g/cm³",
      "testStandard": "ASTM D792",
      "source": "src_tds",
      "confidence": "medium"
    },
    "nozzleTemperature": {
      "value": 250,
      "unit": "°C",
      "min": 230,
      "max": 270,
      "source": "src_tds",
      "confidence": "medium"
    },
    "bedTemperature": {
      "value": 100,
      "unit": "°C",
      "min": 90,
      "max": 110,
      "source": "src_tds",
      "confidence": "medium"
    }
  },
  "governance": {
    "lastReviewed": "2026-08-01",
    "reviewedBy": "Claude Code (Erstimport aus Herstellerdatenblatt)",
    "sources": [
      {
        "id": "src_tds",
        "type": "manufacturer-tds",
        "publisher": "FD3D GmbH (Extrudr)",
        "productName": "Extrudr PCTG",
        "title": "Extrudr PCTG — Technisches Datenblatt (DE)",
        "url": "https://s3.extrudr.com/extrudr-media/datasheets/tds/tds-de/pctg-TDS-de.pdf",
        "retrievedAt": "2026-08-01",
        "confidenceCeiling": "high",
        "note": {
          "de": "Herstellerdatenblatt. Die Brandschutz-Einstufungen (UL94, EN 45545) sind entweder erteilt oder nicht und gelten deshalb als gesichert. Bei den mechanischen Werten gibt Extrudr nicht an, ob an gedruckten oder spritzgegossenen Prüfkörpern gemessen wurde; sie gelten deshalb nur als einfach belegt. Temperaturwerte gelten laut Fußnote erst ab 4 mm Wanddicke.",
          "en": "Manufacturer datasheet. The fire ratings (UL94, EN 45545) are either granted or not and therefore count as reliable. For the mechanical values Extrudr does not state whether they were measured on printed or moulded specimens, so they count as singly substantiated only. Temperature values apply only from 4 mm wall thickness according to the footnote."
        }
      }
    ]
  }
}
